{
  "schemaVersion": "1.0.0",
  "review": {
    "issue": "#49",
    "rationale": "Initial release budgets replace the debug-only 120/180 second launch ceilings. Absolute limits are safety rails calibrated from local release observations and the first same-host GitHub runner release comparison, while the current-main comparison remains the primary 20 percent regression gate.",
    "evidence": [
      {
        "source": "Issue #49: 2026-08-25 Linux WebKit measurements and implementation baseline runs",
        "recordedAt": "2026-08-26T00:00:00Z"
      },
      {
        "source": "PR #58 run 32942547888: Linux AppImage baseline/candidate startup p95 was 31.40/31.47 seconds on the same hosted runner with at most 0.69 percent difference",
        "recordedAt": "2026-08-26T08:05:57Z"
      },
      {
        "source": "PR #58 runs 32942547888, 32946504534, and 32950388617: identical bootstrap catalog hooks kept refresh p50 within 785.39-813.42 ms while first-browser p95 ranged from 873.86-1727.80 ms; cached-read p95 ranged from 3.17-59.56 ms",
        "recordedAt": "2026-08-26T09:30:21Z"
      },
      {
        "source": "PR #58 runs 32946504534, 32950388617, and 32953791298: identical Windows bootstrap sources kept candidate warm-start p50 changes to 16.0, 1.9, and 8.6 percent; run 32953791298 failed p95 only because one 984.97 ms Tukey outlier exceeded the 765.82 ms baseline p95",
        "recordedAt": "2026-08-26T09:55:43Z"
      },
      {
        "source": "PR #124 run 33912788179: an unrelated Marketplace launch-retry change produced a 2048.374 ms Windows cold-start p95 against a 1472.412 ms baseline (575.962 ms absolute difference) while the installed MSI and NSIS performance suites passed",
        "recordedAt": "2026-09-04T20:07:03Z"
      },
      {
        "source": "Main runs 33919703993 and 33925549585: Linux release navigation p95 missed its relative gate by 3.441 ms and 21.326 ms respectively on unrelated test-only changes",
        "recordedAt": "2026-09-04T23:01:35Z"
      },
      {
        "source": "Issue #176 runs 35697751425 and 35703788546: unpacking the AppImage once and requesting pageLoadStrategy none both left Linux cold/warm startup near 32 seconds; launch-stage instrumentation isolated 17.9-32.4 seconds inside hosted WebKitWebDriver POST /session while the explicit shell wait took 0.5-1.1 seconds",
        "recordedAt": "2026-09-22T08:10:00Z"
      },
      {
        "source": "Issue #176 run 35710680908: keying both variants' binary caches on a build-input fingerprint cut the candidate legs from 222-312 s to 12-28 s and the Release performance wall clock from 978 s to 481 s with every gate green and no change to matrix dimensions, sample counts, or the 300-second idle windows",
        "recordedAt": "2026-09-22T10:00:00Z"
      },
      {
        "source": "Issue #204, run 35811293444: baseline cold samples [1466.821,1418.416,1475.815], candidate [2093.205,1982.813,2111.658]. The only commit change is the Linux large-workspace gate and its tests; Windows product inputs are identical. Across forty product-unchanged comparisons the largest positive p50 shift is 626.384 ms; p95 maxima differ by up to 4424.656 ms in magnitude. Preserve p95 for the absolute rail, compare sustained startup at p50 with a measured 700 ms additive floor.",
        "recordedAt": "2026-09-24T00:00:00Z"
      }
    ]
  },
  "changeControl": {
    "environmentOverridesAllowed": false,
    "requiredReview": "CODEOWNERS",
    "performanceFailureRerun": "preserve-original-failure"
  },
  "compatibilityFields": [
    "benchmark.suite",
    "benchmark.platform",
    "benchmark.buildProfile",
    "benchmark.packageKind",
    "host.os",
    "host.arch",
    "host.runnerImage",
    "host.cpuModel",
    "host.logicalCores",
    "host.memoryClassBytes",
    "host.webviewVersion",
    "fixture",
    "sampling"
  ],
  "platforms": {
    "linux": {
      "suites": {
        "release-webview": {
          "relativeNoiseFloor": {
            "ms": 50,
            "bytes": 33554432,
            "percent": 1,
            "count": 1
          },
          "metrics": {
            "coldStartupMs": {
              "statistic": "p95",
              "absoluteMax": 40000,
              "relativeMaxPercent": 20,
              "rationale": "Hosted Linux custom-binary WebKitWebDriver spends 17.9 to 32.4 seconds inside POST /session before the explicit application-shell wait, while AppImage extraction mode and the standard pageLoadStrategy capability do not change the plateau. The workflow now supplies the desktop session bus expected by WebKitGTK and keeps launch-stage timing visible. The 40 second absolute rail remains unchanged until corrected hosted evidence is reviewed; the same-host 20 percent comparison is the working regression gate."
            },
            "warmStartupMs": {
              "statistic": "p95",
              "absoluteMax": 40000,
              "relativeMaxPercent": 20,
              "rationale": "Warm startup shares the same hosted WebKitWebDriver POST /session plateau as cold startup even though the following explicit shell wait is only 0.5 to 1.1 seconds. The workflow supplies a desktop session bus without changing the ready-shell condition, sample count, or cache semantics. The unchanged 40 second safety rail will be tightened only after corrected hosted evidence is available."
            },
            "firstIpcMs": {
              "statistic": "p95",
              "absoluteMax": 3000,
              "relativeMaxPercent": 20,
              "rationale": "The environment IPC observation was 346 ms; this retains hosted-runner headroom."
            },
            "environmentSlowMs": {
              "statistic": "p95",
              "absoluteMax": 5000,
              "relativeMaxPercent": 20,
              "rationale": "A tracked 400 ms backend delay verifies that slow environment discovery remains observable and bounded."
            },
            "environmentTimeoutRecoveryMs": {
              "statistic": "p95",
              "relativeStatistic": "p50",
              "absoluteMax": 6000,
              "relativeMaxPercent": 20,
              "rationale": "A client deadline against a two-second probe must recover on the next normal environment request. The 6000 ms absolute rail still reads p95, but the relative comparison reads p50 because the p95 of this metric is not a distribution tail. Across twenty-six Linux sample sets the second of the three post-warm-up samples was the maximum in twenty-two of them, so nearest-rank p95 at n=3 re-measures one reproducible blip whose size swings between 1.05 and 2.36 times the median. Comparing two draws of that blip failed three of thirteen product-unchanged runs; comparing medians failed one."
            },
            "catalogCachedMs": {
              "statistic": "p95",
              "absoluteMax": 750,
              "relativeMaxPercent": 20,
              "relativeNoiseFloor": 75,
              "rationale": "A valid disk catalog must be visible without waiting for an isolated refresh. Three same-host bootstrap comparisons observed 3.17-59.56 ms p95, so this metric uses a reviewed 75 ms floor while retaining the 750 ms safety ceiling."
            },
            "catalogRefreshMs": {
              "statistic": "p50",
              "absoluteMax": 4000,
              "relativeMaxPercent": 20,
              "relativeNoiseFloor": 400,
              "rationale": "The isolated loopback catalog fixture remains independent of external Marketplace health and gates p50 because browser bootstrap makes p95 unstable. Seventeen product-unchanged comparisons put p50 between 706 and 1331 ms and the same-run absolute delta between 29 and 362 ms; the 20 percent allowance failed once when a low 944 ms baseline reduced it below the observed additive noise. A reviewed 400 ms floor covers that corpus with 38 ms headroom. To compensate rather than relax quality, the absolute p50 rail is tightened from 15000 to 4000 ms, still 3.0 times the largest observed p50."
            },
            "smallWorkspaceScanMs": {
              "statistic": "p95",
              "absoluteMax": 3000,
              "relativeMaxPercent": 20,
              "rationale": "The one-project observation was 16 ms and should not regress into user-visible delay."
            },
            "largeWorkspaceScanMs": {
              "statistic": "p95",
              "relativeStatistic": "p50",
              "absoluteMax": 12000,
              "relativeMaxPercent": 20,
              "rationale": "The realistic tier carries enough projects and bytes to expose linear scan regressions, and the 12000 ms rail still reads p95 for that. The relative comparison reads p50 because this metric's p95 at n=3 is one sporadic blip, not a tail. Across thirty-two Linux sample sets p50 stayed within 18.0 to 44.4 ms and the candidate-to-baseline p50 gap never exceeded 14.2 ms, while p95 ranged from 21.0 to 143.0 ms and reached three to four times the median in six of them. The maximum lands at index 0, 1, or 2 in five, sixteen, and eleven sets, so unlike environmentTimeoutRecoveryMs and navigationMs this blip is not positional; the relative gate was subtracting two independent draws of it and read -57.89 to +107.75 percent on product-unchanged runs, failing one of sixteen. Medians failed none, the 50 ms floor still catches a sustained 35 ms shift against the observed 14.2 ms gap, and the largest value ever seen on the rail is 143 ms."
            },
            "navigationMs": {
              "statistic": "p95",
              "relativeStatistic": "p50",
              "absoluteMax": 1500,
              "relativeMaxPercent": 20,
              "relativeNoiseFloor": 100,